{
	"governingLawState": "MI",
	"transactionDate": "11/02/2020",
  "applicationDate": "10/15/2020",
  "activityType": 1,
  "isCommunityProperty": false,
	"applicants": {
    "individuals": [
      {
        "ID": "123456",
        "firstName": "Sharon",
        "lastName": "Smith",
        "middleName": "Marie",
        "suffixName": "",
        "address": {
          "primaryAddressLine": "999 Autumn St",
          "city": "Grand Rapids",
          "state": "MI",
          "postalCode": "49546"
        },
        "ssn": "123555999",
        "dateOfBirth": "11/03/1960",
        "tinStatus": 6,
        "previousAddresses": [
          {
            "primaryAddressLine": "123 Last St",
            "city": "Grand Rapids",
            "state": "MI",
            "postalCode": "49546"
          }
        ],
        "employers": [
          {
            "name": "ABC Plumbing",
            "address": {
              "primaryAddressLine": "555 Plumbing St",
              "city": "Grand Rapids",
              "state": "MI",
              "postalCode": "49546"
            },
            "isSelfEmployment": 0,
            "lengthOfEmploymentMonths": "52"
          }
        ],
        "previousEmployers": [
          {
            "name": "XYZ Plumbing",
            "address": {
              "primaryAddressLine": "123 Main St",
              "city": "Grand Rapids",
              "state": "MI",
              "postalCode": "49546"
            },
            "isSelfEmployment": 0
          }
        ],
        "identifications": [
          {
            "description": "Drivers License",
            "number": "XZ56654546",
            "issuer": "State of Michigan",
            "issueDate": "05/01/2019",
            "expirationDate": "05/01/2022"
          },
          {
            "description": "Military ID",
            "number": "998798797",
            "issuer": "U.S. Space Force",
            "issueDate": "10/01/2019",
            "expirationDate": "10/01/2022"
          }
        ],
        "phones": [
          {
            "type": 1,
            "number": "360-555-7899"
          },
          {
            "type": 2,
            "number": "360-123-1238"
          }
        ],
        "isOFACVerified": false,
        "spouseID": "987655"
      },
      {
        "ID": "987655",
        "firstName": "John",
        "middleName": "Edward",
        "lastName": "Smith",
        "suffixName": "Jr",
        "ssn": "123777777",
        "dateOfBirth": "11/02/1961",
        "tinStatus": 6,
        "spouseID": "123456",
        "address": {
          "primaryAddressLine": "999 Autumn St",
          "city": "Grand Rapids",
          "state": "MI",
          "postalCode": "49546"
        },
        "previousAddresses": [
          {
            "primaryAddressLine": "123 Last St",
            "city": "Grand Rapids",
            "state": "MI",
            "postalCode": "49546"
          }
        ]
      },
      {
        "ID": "123589",
        "firstName": "Debbie",
        "lastName": "Deputy",
        "ssn": "456882546",
        "dateOfBirth": "11/02/1963",
        "tinStatus": 6,
        "address": {
          "primaryAddressLine": "999 Test St",
          "city": "Grand Rapids",
          "state": "MI",
          "postalCode": "49546"
        }
      },
      {
        "ID": "657852",
        "firstName": "Philip",
        "lastName": "Appointee",
        "ssn": "458852465",
        "dateOfBirth": "11/19/1955",
        "tinStatus": 6,
        "address": {
          "primaryAddressLine": "999 Appointee St",
          "city": "Grand Rapids",
          "state": "MI",
          "postalCode": "49546"
        }
      }
    ]
	},
	"accounts": [
    {
      "ID": 516511,
      "number": "54654444",
      "type": 6,
      "ownershipStructure": 1,
      "ownershipType": 3,
      "primaryOwnerID": "123456",
      "productCode": "SafeDepositBox",
      "productDescription": "Safe Deposit Box",
      "owners": [
        "123456",
        "987655"
      ],
      "safeDepositBox": {
        "size": "4 X 6",
        "numberOfKeys": 2,
        "numberOfRequiredRentersToAccess": 2,
        "deputies": [
          "123589"
        ],
        "appointees": [
          "657852"
        ]
      },
      "statementMailingAddress": {
        "primaryAddressLine": "999 Autumn St",
        "city": "Austin",
        "state": "NC",
        "postalCode": "49546"
      }
    }
	],
	"financialInstitution": {
		"name": "CS Bank",
		"address": {
			"primaryAddressLine": "12345 Bank Ave",
			"city": "Grand Rapids",
			"state": "MI",
			"postalCode": "49546"
		},
		"decisionOfficer": {
			"name": "Bill Thomas",
			"title": "Sr. Underwriter"
		},
		"documentSigner": {
			"name": "Aliyah Brown",
			"title": "Branch Manager"
		},
		"documentPreparer": {
			"name": "Aliyah Brown",
			"title": "Branch Manager"
		},
		"openingBranch": {
			"name": "Waterworks",
			"code": "X5555",
			"address": {
				"primaryAddressLine": "123 Branch St.",
				"city": "Grand Rapids",
				"state": "MI",
				"postalCode": "49546"
			}
		}
	}
}
