{
	"governingLawState": "MI",
	"transactionDate": "11/02/2020",
  "applicationDate": "10/15/2020",
  "activityType": 1,
  "applicants": {
    "individuals": [
      {
        "ID": "123456",
        "firstName": "Sharon",
        "lastName": "Smith",
        "middleName": "Marie",
        "suffixName": "",
        "address": {
          "primaryAddressLine": "999 Autumn St",
          "city": "Grand Rapids",
          "state": "MI",
          "postalCode": "49546"
        },
        "ssn": "123555999",
        "dateOfBirth": "11/03/1960",
        "tinStatus": 6,
        "previousAddresses": [
          {
            "primaryAddressLine": "123 Last St",
            "city": "Grand Rapids",
            "state": "MI",
            "postalCode": "49546"
          }
        ],
        "employers": [
          {
            "name": "ABC Plumbing",
            "address": {
              "primaryAddressLine": "555 Plumbing St",
              "city": "Grand Rapids",
              "state": "MI",
              "postalCode": "49546"
            },
            "isSelfEmployment": 0,
            "lengthOfEmploymentMonths": "52"
          }
        ],
        "previousEmployers": [
          {
            "name": "XYZ Plumbing",
            "address": {
              "primaryAddressLine": "123 Main St",
              "city": "Grand Rapids",
              "state": "MI",
              "postalCode": "49546"
            },
            "isSelfEmployment": 0
          }
        ],
        "identifications": [
          {
            "description": "Drivers License",
            "number": "XZ56654546",
            "issuer": "State of Michigan",
            "issueDate": "05/01/2019",
            "expirationDate": "05/01/2022"
          },
          {
            "description": "Military ID",
            "number": "998798797",
            "issuer": "U.S. Space Force",
            "issueDate": "10/01/2019",
            "expirationDate": "10/01/2022"
          }
        ],
        "phones": [
          {
            "type": 1,
            "number": "360-555-7899"
          },
          {
            "type": 2,
            "number": "360-123-1238"
          }
        ],
        "isOFACVerified": false,
        "spouseID": "987655"
      },
      {
        "ID": "987655",
        "isPrimaryOwner": false,
        "firstName": "John",
        "middleName": "Edward",
        "lastName": "Smith",
        "suffixName": "Jr",
        "ssn": "123777777",
        "dateOfBirth": "11/02/1961",
        "tinStatus": 6,
        "spouseID": "123456",
        "address": {
          "primaryAddressLine": "999 Autumn St",
          "city": "Grand Rapids",
          "state": "MI",
          "postalCode": "49546"
        },
        "previousAddresses": [
          {
            "primaryAddressLine": "123 Last St",
            "city": "Grand Rapids",
            "state": "MI",
            "postalCode": "49546"
          }
        ]
      }
    ],
    "businesses": [
      {
        "ID": "987654",
        "name": "Owner Ward LLC",
        "entityType": 6,
        "tin": "123456789",
        "parentCompanyIDs": "",
        "dba": "",
        "natureOfBusiness": "",
        "establishedDate": "09/15/2001",
        "isNonProfit": false,
        "resolutionOnFileType": 1,
        "principalOfficeState": "MI",
        "principalOfficeCity": "Grand Rapids",
        "address": {
          "primaryAddressLine": "123 Main St.",
          "state": "MI",
          "city": "Grand Rapids",
          "postalCode": "49546"
        },
        "isEngagesInInternetGambling": false,
        "signers": [
          {
            "ID": "55555",
            "firstName": "Jim",
            "middleName": "James",
            "lastName": "Smith",
            "suffixName": "Jr",
            "address": {
              "primaryAddressLine": "123 Test St.",
              "state": "MI",
              "city": "Grand Rapids",
              "postalCode": "49546"
            },
            "dateOfBirth": "06/03/1954",
            "ssn": "555666777",
            "isDocumentSigner": true,
            "isResolutionSigner": true,
            "isResolutionCertifier": false,
            "isBeneficialOwner": true,
            "isBeneficialOwnerManager": false,
            "isBeneficialOwnerCertifier": false,
            "isTINCertifier": false,
            "capacityDescription": "Member"
          },
          {
            "ID": "66666",
            "firstName": "Carrie",
            "lastName": "Wilson",
            "address": {
              "primaryAddressLine": "123 Carrie St.",
              "state": "MI",
              "city": "Grand Rapids",
              "postalCode": "49546"
            },
            "dateOfBirth": "06/09/1969",
            "ssn": "111222333",
            "isDocumentSigner": true,
            "isResolutionSigner": true,
            "isResolutionCertifier": true,
            "isBeneficialOwner": true,
            "isBeneficialOwnerManager": true,
            "isBeneficialOwnerCertifier": true,
            "isTINCertifier": true,
            "capacityDescription": "President"
          },
          {
            "ID": "77777",
            "firstName": "Patricia",
            "middleName": "Beth",
            "lastName": "Drake",
            "address": {
              "primaryAddressLine": "123 Drake St.",
              "state": "MI",
              "city": "Grand Rapids",
              "postalCode": "49546"
            },
            "dateOfBirth": "07/03/1979",
            "ssn": "222333444",
            "isDocumentSigner": true,
            "isResolutionSigner": true,
            "isResolutionCertifier": false,
            "isBeneficialOwner": true,
            "isBeneficialOwnerManager": false,
            "isBeneficialOwnerCertifier": false,
            "isTINCertifier": false,
            "capacityDescription": "Member"
          }
        ]
      },
      {
        "ID": "113355",
        "name": "Appointed Inc.",
        "entityType": 8,
        "tin": "123456788",
        "parentCompanyIDs": "",
        "dba": "",
        "natureOfBusiness": "",
        "establishedDate": "09/15/2003",
        "isNonProfit": false,
        "resolutionOnFileType": 1,
        "principalOfficeState": "MI",
        "principalOfficeCity": "Grand Rapids",
        "address": {
          "primaryAddressLine": "123 Appoint St.",
          "state": "MI",
          "city": "Grand Rapids",
          "postalCode": "49546"
        },
        "isEngagesInInternetGambling": false,
        "signers": [
          {
            "ID": "85238",
            "firstName": "Aditya",
            "lastName": "Patel",
            "address": {
              "primaryAddressLine": "123 Appoint St.",
              "state": "MI",
              "city": "Grand Rapids",
              "postalCode": "49546"
            },
            "dateOfBirth": "06/09/1951",
            "ssn": "555666782",
            "isDocumentSigner": true,
            "isResolutionSigner": true,
            "isResolutionCertifier": true,
            "isBeneficialOwner": false,
            "isBeneficialOwnerManager": true,
            "isBeneficialOwnerCertifier": true,
            "isTINCertifier": true,
            "capacityDescription": "CEO"
          }
        ]
      }
    ]
  },
	"accounts": [
    {
      "ID": 516511,
      "number": "54654444",
      "type": 2,
      "ownershipStructure": 6,
      "primaryOwnerID": "987654",
      "productCode": "BusCheck",
      "productDescription": "Business Checking",
      "owners": [
        "123456",
        "987654"
      ],
      "fiduciaries": [
        "113355",
        "987655"
      ],
      "depositAmount": 10000.00,
      "statementMailingAddress": {
        "primaryAddressLine": "999 Autumn St",
        "city": "Austin",
        "state": "NC",
        "postalCode": "49546"
      }
    }
	],
	"financialInstitution": {
		"name": "CS Bank",
		"address": {
			"primaryAddressLine": "12345 Bank Ave",
			"city": "Grand Rapids",
			"state": "MI",
			"postalCode": "49546"
		},
		"decisionOfficer": {
			"name": "Bill Thomas",
			"title": "Sr. Underwriter"
		},
		"documentSigner": {
			"name": "Aliyah Brown",
			"title": "Branch Manager"
		},
		"documentPreparer": {
			"name": "Aliyah Brown",
			"title": "Branch Manager"
		},
		"openingBranch": {
			"name": "Waterworks",
			"code": "X5555",
			"address": {
				"primaryAddressLine": "123 Branch St.",
				"city": "Grand Rapids",
				"state": "MI",
				"postalCode": "49546"
			}
		}
	}
}
