{
	"governingLawState": "TX",
	"transactionDate": "11/02/2020",
  "applicationDate": "10/15/2020",
  "activityType": 1,
  "isCommunityProperty": false,
	"applicants": {
		"individuals": [
			{
        "ID": "123456",
				"firstName": "Sharon",
				"lastName": "Smith",
				"middleName": "Marie",
        "suffixName": "",
				"address": {
					"primaryAddressLine": "999 Autumn St",
					"city": "Austin",
					"state": "TX",
					"postalCode": "49546"
				},
        "ssn": "123555999",
        "tinStatus": 6,
				"previousAddresses": [
					{
						"primaryAddressLine": "123 Last St",
						"city": "Austin",
						"state": "TX",
						"postalCode": "49546"
					}
				],
				"employers": [
					{
						"name": "ABC Plumbing",
						"address": {
							"primaryAddressLine": "555 Plumbing St",
							"city": "Austin",
							"state": "TX",
							"postalCode": "49546"
						},
						"isSelfEmployment": 0,
						"lengthOfEmploymentMonths": "52"
					}
				],
				"previousEmployers": [
					{
						"name": "XYZ Plumbing",
						"address": {
							"primaryAddressLine": "123 Main St",
							"city": "Austin",
							"state": "TX",
							"postalCode": "49546"
						},
						"isSelfEmployment": 0
					}
				],
        "identifications": [
          {
            "description": "Drivers License",
            "number": "XZ56654546",
            "issuer": "State of Michigan",
            "issueDate": "05/01/2019",
            "expirationDate": "05/01/2022"
          },
          {
            "description": "Military ID",
            "number": "998798797",
            "issuer": "U.S. Space Force",
            "issueDate": "10/01/2019",
            "expirationDate": "10/01/2022"
          }
        ],
        "phones": [
          {
            "type": 1,
            "number": "360-555-7899"
          },
          {
            "type": 2,
            "number": "360-123-1238"
          }
        ],
        "isOFACVerified": false,
        "spouseID": "987655",
        "ATMDebitCard": {
            "type": 2,
            "number": "4145222266669999",
            "cardholderStatus": 2,
            "cardStatus": 1,
            "linkedAccounts": [
              "516511"
            ]
        }
			},
      {
        "ID": "987655",
        "isPrimaryOwner": false,
        "firstName": "John",
        "middleName": "Edward",
        "lastName": "Smith",
        "suffixName": "Jr",
        "ssn": "123777777",
        "tinStatus": 6,
        "spouseID": "123456",
        "address": {
          "primaryAddressLine": "999 Autumn St",
          "city": "Austin",
          "state": "TX",
          "postalCode": "49546"
        },
        "previousAddresses": [
          {
            "primaryAddressLine": "123 Last St",
            "city": "Austin",
            "state": "TX",
            "postalCode": "49546"
          }
        ],
        "ATMDebitCard": {
          "type": 2,
          "number": "4145222266668888",
          "cardholderStatus": 2,
          "cardStatus": 1,
          "linkedAccounts": [
            "516511"
          ]
        }
      }
		]
	},
  "contacts": [
    {
      "ID": "654222",
      "entityType": "",
      "firstName": "Joseph",
      "lastName": "Baker",
      "businessName": "",
      "title": "Beneficiary",
      "address": {
        "primaryAddressLine": "123 Baker",
        "city": "Austin",
        "state": "TX",
        "postalCode": "49546"
      }
    },
    {
      "ID": "654339",
      "entityType": "",
      "firstName": "Aliyah",
      "lastName": "Baker",
      "businessName": "",
      "title": "Beneficiary",
      "address": {
        "primaryAddressLine": "123 Baker",
        "city": "Austin",
        "state": "TX",
        "postalCode": "49546"
      }
    }
  ],
	"accounts": [
    {
      "ID": 516511,
      "number": "54654444",
      "type": 1,
      "ownershipStructure": 2,
      "ownershipType": 17,
      "primaryOwnerID": "123456",
      "productCode": "BasicChecking",
      "productDescription": "Basic Checking",
      "owners": [
        "123456",
        "987655"
      ],
      "depositAmount": 10000.00,
      "beneficiaries": [
        "654222",
        "654339"
      ],
      "statementMailingAddress": {
        "primaryAddressLine": "999 Autumn St",
        "city": "Austin",
        "state": "NC",
        "postalCode": "49546"
      }
    }
	],
	"financialInstitution": {
		"name": "CS Bank",
		"address": {
			"primaryAddressLine": "12345 Bank Ave",
			"city": "Austin",
			"state": "TX",
			"postalCode": "49546"
		},
		"decisionOfficer": {
			"name": "Bill Thomas",
			"title": "Sr. Underwriter"
		},
		"documentSigner": {
			"name": "Aliyah Brown",
			"title": "Branch Manager"
		},
		"documentPreparer": {
			"name": "Aliyah Brown",
			"title": "Branch Manager"
		},
		"openingBranch": {
			"name": "Waterworks",
			"code": "X5555",
			"address": {
				"primaryAddressLine": "123 Branch St.",
				"city": "Austin",
				"state": "TX",
				"postalCode": "49546"
			}
		}
	}
}
