{
	"governingLawState": "TX",
	"transactionDate": "11/02/2020",
  "applicationDate": "10/15/2020",
  "activityType": 1,
  "isCommunityProperty": false,
	"applicants": {
		"individuals": [
      {
        "ID": "123456",
        "firstName": "Sharon",
        "lastName": "Smith",
        "middleName": "Marie",
        "suffixName": "",
        "address": {
          "primaryAddressLine": "999 Autumn St",
          "city": "Austin",
          "state": "TX",
          "postalCode": "49546"
        },
        "ssn": "123555999",
        "dateOfBirth": "11/03/1960",
        "tinStatus": 6,
        "previousAddresses": [
          {
            "primaryAddressLine": "123 Last St",
            "city": "Austin",
            "state": "TX",
            "postalCode": "49546"
          }
        ],
        "employers": [
          {
            "name": "ABC Plumbing",
            "address": {
              "primaryAddressLine": "555 Plumbing St",
              "city": "Austin",
              "state": "TX",
              "postalCode": "49546"
            },
            "isSelfEmployment": 0,
            "lengthOfEmploymentMonths": "52"
          }
        ],
        "previousEmployers": [
          {
            "name": "XYZ Plumbing",
            "address": {
              "primaryAddressLine": "123 Main St",
              "city": "Austin",
              "state": "TX",
              "postalCode": "49546"
            },
            "isSelfEmployment": 0
          }
        ],
        "identifications": [
          {
            "description": "Drivers License",
            "number": "XZ56654546",
            "issuer": "State of Michigan",
            "issueDate": "05/01/2019",
            "expirationDate": "05/01/2022"
          },
          {
            "description": "Military ID",
            "number": "998798797",
            "issuer": "U.S. Space Force",
            "issueDate": "10/01/2019",
            "expirationDate": "10/01/2022"
          }
        ],
        "phones": [
          {
            "type": 1,
            "number": "360-555-7899"
          },
          {
            "type": 2,
            "number": "360-123-1238"
          }
        ],
        "isOFACVerified": false,
        "spouseID": "987655"
      }
		]
	},
	"contacts": [
		{
			"ID": "654222",
      "entityType": "",
      "firstName": "Sarah",
      "lastName": "Signer",
      "businessName": "",
      "title": "Convenience Signer",
			"address": {
				"primaryAddressLine": "123 Sarah",
				"city": "Austin",
				"state": "TX",
				"postalCode": "49546"
			}
		}
	],
	"accounts": [
    {
      "ID": 516511,
      "number": "54654444",
      "type": 1,
      "ownershipStructure": 4,
      "primaryOwnerID": "123456",
      "productCode": "GoldSav",
      "productDescription": "Gold Savings",
      "owners": [
        "123456"
      ],
      "rateStructure": 1,
      "rateType": 2,
      "compoundingFrequency": 3,
      "creditingFrequency": 3,
      "interestPaymentMethod": 1,
      "rates": [
        {
          "interestRate": 0.85,
          "apy": 0.86
        }
      ],
      "depositAmount": 10000.00,
      "authorizedSigners": [
        {
          "ID": "654222",
          "isDurable": false
        }
      ]
    }
	],
	"financialInstitution": {
		"name": "CS Bank",
		"address": {
			"primaryAddressLine": "12345 Bank Ave",
			"city": "Austin",
			"state": "TX",
			"postalCode": "49546"
		},
		"decisionOfficer": {
			"name": "Bill Thomas",
			"title": "Sr. Underwriter"
		},
		"documentSigner": {
			"name": "Aliyah Brown",
			"title": "Branch Manager"
		},
		"documentPreparer": {
			"name": "Aliyah Brown",
			"title": "Branch Manager"
		},
		"openingBranch": {
			"name": "Waterworks",
			"code": "X5555",
			"address": {
				"primaryAddressLine": "123 Branch St.",
				"city": "Austin",
				"state": "TX",
				"postalCode": "49546"
			}
		}
	}
}
