{
	"governingLawState": "MI",
	"transactionDate": "11/02/2020",
  "applicationDate": "10/15/2020",
  "activityType": 1,
	"applicants": {
    "businesses": [
      {
        "ID": "987654",
        "name": "Smith Family Estate",
        "entityType": 12,
        "tin": "123456789",
        "parentCompanyIDs": "",
        "dba": "",
        "natureOfBusiness": "",
        "establishedDate": "09/15/2001",
        "principalOfficeState": "MI",
        "principalOfficeCity": "Grand Rapids",
        "address": {
          "primaryAddressLine": "123 Main St.",
          "state": "MI",
          "city": "Grand Rapids",
          "postalCode": "49546"
        },
        "isEngagesInInternetGambling": false,
        "signers": [
          {
            "ID": "55555",
            "firstName": "Jim",
            "middleName": "James",
            "lastName": "Smith",
            "suffixName": "Jr",
            "address": {
              "primaryAddressLine": "123 Test St.",
              "state": "MI",
              "city": "Grand Rapids",
              "postalCode": "49546"
            },
            "dateOfBirth": "06/03/1954",
            "ssn": "555666777",
            "isDocumentSigner": true,
            "isResolutionSigner": false,
            "isResolutionCertifier": false,
            "isBeneficialOwner": false,
            "isBeneficialOwnerManager": false,
            "isBeneficialOwnerCertifier": false,
            "isTINCertifier": true,
            "capacityDescription": "Fiduciary Appointee"
          }
        ]
      }
    ]
	},
	"accounts": [
    {
      "ID": 516511,
      "number": "54654444",
      "type": 1,
      "ownershipStructure": 1,
      "primaryOwnerID": "987654",
      "productCode": "GoldSav",
      "productDescription": "Gold Savings",
      "owners": [
        "987654"
      ],
      "rateStructure": 1,
      "rateType": 2,
      "compoundingFrequency": 3,
      "creditingFrequency": 3,
      "interestPaymentMethod": 1,
      "rates": [
        {
          "interestRate": 0.85,
          "apy": 0.86
        }
      ],
      "depositAmount": 10000.00,
      "statementMailingAddress": {
        "primaryAddressLine": "999 Autumn St",
        "city": "Austin",
        "state": "NC",
        "postalCode": "49546"
      }
    }
	],
	"financialInstitution": {
		"name": "CS Bank",
		"address": {
			"primaryAddressLine": "12345 Bank Ave",
			"city": "Grand Rapids",
			"state": "MI",
			"postalCode": "49546"
		},
		"decisionOfficer": {
			"name": "Bill Thomas",
			"title": "Sr. Underwriter"
		},
		"documentSigner": {
			"name": "Aliyah Brown",
			"title": "Branch Manager"
		},
		"documentPreparer": {
			"name": "Aliyah Brown",
			"title": "Branch Manager"
		},
		"openingBranch": {
			"name": "Waterworks",
			"code": "X5555",
			"address": {
				"primaryAddressLine": "123 Branch St.",
				"city": "Grand Rapids",
				"state": "MI",
				"postalCode": "49546"
			}
		}
	}
}
